{"type":"mail.received.v1","event_id":"f8c1e9a0-1a98-4fb8-8ca1-4c0a3e710016","received_at":"2026-09-28T08:00:00.000Z","canary":{"run_id":"canary-2026-09-28"},"message":{"id":"f8c1e9a0-1a98-4fb8-8ca1-4c0a3e720016","from":[{"address":"synthetic@example.org","name":"Mail Hero"}],"to":[],"subject":"Mail Hero canary","sent_at":null,"rfc_message_id":null,"text":"This is a synthetic Mail Hero end-to-end canary. It asks for nothing: consumers must not create tasks, messages or reports for it.","text_truncated":false,"original_text_bytes":130,"html_omitted":false,"needs_review":false,"warnings":[],"content_policy_version":"storage-v1","attachments_omitted_count":0,"attachments":[]}}